{
  "parsed": {
    "summary_date": "2025-10-22",
    "user_id": "bDfBGKfcMCVx2FtXMsJVGITGYt32",
    "totals": {
      "calories_kcal": 155.0,
      "protein_g": 12.5,
      "total_carbohydrate_g": 14.2,
      "total_lipid_(fat)_g": 0.0
    },
    "percent_dv": {},
    "meal_cards": [
      {
        "meal_name": "panner rice bowl",
        "calories_kcal": 155.0,
        "protein_g": 12.5,
        "total_carbohydrate_g": 14.2,
        "total_lipid_(fat)_g": 0.0
      },
      {
        "meal_name": "chicken biryani",
        "calories_kcal": 0.0,
        "protein_g": 0.0,
        "total_carbohydrate_g": 0.0,
        "total_lipid_(fat)_g": 0.0
      }
    ],
    "insights": {
      "wins": [
        "You included a good source of protein and carbohydrates with your panner rice bowl."
      ],
      "improvements": [
        "Your total calorie intake for the day appears very low, suggesting you may have missed logging some meals or need to increase your intake.",
        "There was no fat recorded for any of your meals. Healthy fats are crucial for overall health and nutrient absorption.",
        "The 'chicken biryani' entry had no nutritional data. Ensuring all logged items have complete information helps provide an accurate summary."
      ],
      "quick_tips": [
        "Review your day to ensure all meals and snacks have been logged accurately, especially for the 'chicken biryani' entry.",
        "Consider incorporating healthy fat sources like avocados, nuts, seeds, or olive oil into your meals.",
        "Aim for a more balanced intake across all macronutrients to meet your daily energy and nutritional needs."
      ]
    },
    "confidence": "medium"
  },
  "parsed_json_text": "{\n  \"summary_date\": \"2025-10-22\",\n  \"user_id\": \"bDfBGKfcMCVx2FtXMsJVGITGYt32\",\n  \"totals\": {\n    \"calories_kcal\": 155.0,\n    \"protein_g\": 12.5,\n    \"total_carbohydrate_g\": 14.2,\n    \"total_lipid_(fat)_g\": 0.0\n  },\n  \"percent_dv\": {},\n  \"meal_cards\": [\n    {\n      \"meal_name\": \"panner rice bowl\",\n      \"calories_kcal\": 155.0,\n      \"protein_g\": 12.5,\n      \"total_carbohydrate_g\": 14.2,\n      \"total_lipid_(fat)_g\": 0.0\n    },\n    {\n      \"meal_name\": \"chicken biryani\",\n      \"calories_kcal\": 0.0,\n      \"protein_g\": 0.0,\n      \"total_carbohydrate_g\": 0.0,\n      \"total_lipid_(fat)_g\": 0.0\n    }\n  ],\n  \"insights\": {\n    \"wins\": [\n      \"You included a good source of protein and carbohydrates with your panner rice bowl.\"\n    ],\n    \"improvements\": [\n      \"Your total calorie intake for the day appears very low, suggesting you may have missed logging some meals or need to increase your intake.\",\n      \"There was no fat recorded for any of your meals. Healthy fats are crucial for overall health and nutrient absorption.\",\n      \"The 'chicken biryani' entry had no nutritional data. Ensuring all logged items have complete information helps provide an accurate summary.\"\n    ],\n    \"quick_tips\": [\n      \"Review your day to ensure all meals and snacks have been logged accurately, especially for the 'chicken biryani' entry.\",\n      \"Consider incorporating healthy fat sources like avocados, nuts, seeds, or olive oil into your meals.\",\n      \"Aim for a more balanced intake across all macronutrients to meet your daily energy and nutritional needs.\"\n    ]\n  },\n  \"confidence\": \"medium\"\n}",
  "human_summary": "```\n### Daily Nutrition Recap\n\nOn October 22nd, your logged meals indicate a total intake of 155 calories, with 12.5g of protein, 14.2g of carbohydrates, and 0g of fat. The panner rice bowl contributed all of these nutrients, providing a good start with protein and carbs.\n\nHowever, your overall intake for the day appears significantly low, suggesting that some meals or snacks might not have been logged. A notable area for improvement is the complete absence of fat in your recorded meals. Healthy fats are essential for energy, hormone production, and the absorption of fat-soluble vitamins. Additionally, the \"chicken biryani\" entry was logged without any nutritional data, which impacts the accuracy of your daily summary.\n\nTo enhance your nutritional tracking and intake, please ensure all meals and snacks are logged with complete nutritional information. Consider incorporating healthy fat sources such as nuts, seeds, avocados, or olive oil into your diet to achieve a more balanced macronutrient profile. Aiming for a more comprehensive and balanced intake will better support your energy levels and overall health goals.",
  "totals": {
    "calories": 155.0,
    "protein": 12.5,
    "carbs": 14.2,
    "fats": 0.0
  },
  "firestore_saved": null,
  "raw_ai_text_snippet": "```json\n{\n  \"summary_date\": \"2025-10-22\",\n  \"user_id\": \"bDfBGKfcMCVx2FtXMsJVGITGYt32\",\n  \"totals\": {\n    \"calories_kcal\": 155.0,\n    \"protein_g\": 12.5,\n    \"total_carbohydrate_g\": 14.2,\n    \"total_lipid_(fat)_g\": 0.0\n  },\n  \"percent_dv\": {},\n  \"meal_cards\": [\n    {\n      \"meal_name\": \"panner rice bowl\",\n      \"calories_kcal\": 155.0,\n      \"protein_g\": 12.5,\n      \"total_carbohydrate_g\": 14.2,\n      \"total_lipid_(fat)_g\": 0.0\n    },\n    {\n      \"meal_name\": \"chicken biryani\",\n      \"calories_kcal\": 0.0,\n      \"protein_g\": 0.0,\n      \"total_carbohydrate_g\": 0.0,\n      \"total_lipid_(fat)_g\": 0.0\n    }\n  ],\n  \"insights\": {\n    \"wins\": [\n      \"You included a good source of protein and carbohydrates with your panner rice bowl.\"\n    ],\n    \"improvements\": [\n      \"Your total calorie intake for the day appears very low, suggesting you may have missed logging some meals or need to increase your intake.\",\n      \"There was no fat recorded for any of your meals. Healthy fats are crucial for overall health and nutrient absorption.\",\n      \"The 'chicken biryani' entry had no nutritional data. Ensuring all logged items have complete information helps provide an accurate summary.\"\n    ],\n    \"quick_tips\": [\n      \"Review your day to ensure all meals and snacks have been logged accurately, especially for the 'chicken biryani' entry.\",\n      \"Consider incorporating healthy fat sources like avocados, nuts, seeds, or olive oil into your meals.\",\n      \"Aim for a more balanced intake across all macronutrients to meet your daily energy and nutritional needs.\"\n    ]\n  },\n  \"confidence\": \"medium\"\n}\n```\n### Daily Nutrition Recap\n\nOn October 22nd, your logged meals indicate a total intake of 155 calories, with 12.5g of protein, 14.2g of carbohydrates, and 0g of fat. The panner rice bowl contributed all of these nutrients, providing a good start with protein and carbs.\n\nHowever, your overall intake for the day appears significantly low, suggesting that some meals or snacks might not have been logged. A notable area for improvement is the complete absence of fat in your recorded meals. Healthy fats are essential for energy, hormone production, and the absorption of fat-soluble vitamins. Additionally, the \"chicken biryani\" entry was logged without any nutritional data, which impacts the accuracy of your daily summary.\n\nTo enhance your nutritional tracking and intake, please ensure all meals and snacks are logged with complete nutritional information. Consider incorporating healthy fat sources such as nuts, seeds, avocados, or olive oil into your diet to achieve a more balanced macronutrient profile. Aiming for a more comprehensive and balanced intake will better support your energy levels and overall health goals.",
  "generated_at": "2025-10-22T21:46:47"
}